2018,Evolutionary pruning of transfer learned deep convolutional neural network for breast cancer diagnosis in digital breast tomosynthesis,"Deep learning models are highly parameterized, resulting in difficulty in inference and transfer learning for image recognition tasks. In this work, we propose a layered pathway evolution method to compress a deep convolutional neural network (DCNN) for classification of masses in digital breast tomosynthesis (DBT). The objective is to prune the number of tunable parameters while preserving the classification accuracy. In the first stage transfer learning, 19 632 augmented regions-of-interest (ROIs) from 2454 mass lesions on mammograms were used to train a pre-trained DCNN on ImageNet. In the second stage transfer learning, the DCNN was used as a feature extractor followed by feature selection and random forest classification. The pathway evolution was performed using genetic algorithm in an iterative approach with tournament selection driven by count-preserving crossover and mutation. The second stage was trained with 9120 DBT ROIs from 228 mass lesions using leave-one-case-out cross-validation. The DCNN was reduced by 87% in the number of neurons, 34% in the number of parameters, and 95% in the number of multiply-and-add operations required in the convolutional layers. The test AUC on 89 mass lesions from 94 independent DBT cases before and after pruning were 0.88 and 0.90, respectively, and the difference was not statistically significant (p  >  0.05). The proposed DCNN compression approach can reduce the number of required operations by 95% while maintaining the classification performance. The approach can be extended to other deep neural networks and imaging tasks where transfer learning is appropriate."
2019,Semi-Supervised Histology Classification using Deep Multiple Instance Learning and Contrastive Predictive Coding,"Convolutional neural networks can be trained to perform histology slide classification using weak annotations with multiple instance learning (MIL). However, given the paucity of labeled histology data, direct application of MIL can easily suffer from overfitting and the network is unable to learn rich feature representations due to the weak supervisory signal. We propose to overcome such limitations with a two-stage semi-supervised approach that combines the power of data-efficient self-supervised feature learning via contrastive predictive coding (CPC) and the interpretability and flexibility of regularized attention-based MIL. We apply our two-stage CPC + MIL semi-supervised pipeline to the binary classification of breast cancer histology images. Across five random splits, we report state-of-the-art performance with a mean validation accuracy of 95% and an area under the ROC curve of 0.968. We further evaluate the quality of features learned via CPC relative to simple transfer learning and show that strong classification performance using CPC features can be efficiently leveraged under the MIL framework even with the feature encoder frozen."
2022,A Novel Multistage Transfer Learning for Ultrasound Breast Cancer Image Classification,"Breast cancer diagnosis is one of the many areas that has taken advantage of artificial intelligence to achieve better performance, despite the fact that the availability of a large medical image dataset remains a challenge. Transfer learning (TL) is a phenomenon that enables deep learning algorithms to overcome the issue of shortage of training data in constructing an efficient model by transferring knowledge from a given source task to a target task. However, in most cases, ImageNet (natural images) pre-trained models that do not include medical images, are utilized for transfer learning to medical images. Considering the utilization of microscopic cancer cell line images that can be acquired in large amount, we argue that learning from both natural and medical datasets improves performance in ultrasound breast cancer image classification. The proposed multistage transfer learning (MSTL) algorithm was implemented using three pre-trained models: EfficientNetB2, InceptionV3, and ResNet50 with three optimizers: Adam, Adagrad, and stochastic gradient de-scent (SGD). Dataset sizes of 20,400 cancer cell images, 200 ultrasound images from Mendeley and 400 ultrasound images from the MT-Small-Dataset were used. ResNet50-Adagrad-based MSTL achieved a test accuracy of 99 ± 0.612% on the Mendeley dataset and 98.7 ± 1.1% on the MT-Small-Dataset, averaging over 5-fold cross validation. A p-value of 0.01191 was achieved when comparing MSTL against ImageNet based TL for the Mendeley dataset. The result is a significant improvement in the performance of artificial intelligence methods for ultrasound breast cancer classification compared to state-of-the-art methods and could remarkably improve the early diagnosis of breast cancer in young women."
2021,Deep CNN Model based on VGG16 for Breast Cancer Classification,"Deep learning (DL) technologies are becoming a buzzword these days, especially for breast histopathology image tasks, such as diagnosing, due to the high performance obtained in image classification. Among deep learning types, Convolutional Neural Networks (CNN) are the most common types of DL models utilized for medical image diagnosis and analysis. However, CNN suffers from high computation cost to be implemented and may require to adapt huge number of parameters. Thus, and in order to address this issue; several pre-trained models have been established with the predefined network architecture. In this study, a transfer learning model based on Visual Geometry Group with 16-layer deep model architecture (VGG16) is utilized to extract high-level features from the BreaKHis benchmark histopathological images dataset. Then, multiple machine learning models (classifiers) are used to handle different Breast Cancer (BC) histopathological image classification tasks mainly: binary and multiclass with eight-class classifications. The experimental results on the public BreakHis benchmark dataset demonstrate that the proposed models are better than the previous works on the same dataset. Besides, the results show that the proposed models are able to outperform recent classical machine learning algorithms."
2019,Breast Cancer Diagnosis with Transfer Learning and Global Pooling,"Breast cancer is one of the most common causes of cancer-related death in women worldwide. Early and accurate diagnosis of breast cancer may significantly increase the survival rate of patients. In this study, we aim to develop a fully automatic, deep learning-based, method using descriptor features extracted by Deep Convolutional Neural Network (DCNN) models and pooling operation for the classification of hematoxylin and eosin stain (H#E) histological breast cancer images provided as a part of the International Conference on Image Analysis and Recognition (ICIAR) 2018 Grand Challenge on BreAst Cancer Histology (BACH) Images. Different data augmentation methods are applied to optimize the DCNN performance. We also investigated the efficacy of different stain normalization methods as a pre-processing step. The proposed network architecture using a pre-trained Xception model yields 92.50% average classification accuracy."
2017,Deep learning in breast cancer risk assessment: evaluation of convolutional neural networks on a clinical dataset of full-field digital mammograms,"Abstract. To evaluate deep learning in the assessment of breast cancer risk in which convolutional neural networks (CNNs) with transfer learning are used to extract parenchymal characteristics directly from full-field digital mammographic (FFDM) images instead of using computerized radiographic texture analysis (RTA), 456 clinical FFDM cases were included: a “high-risk” BRCA1/2 gene-mutation carriers dataset (53 cases), a “high-risk” unilateral cancer patients dataset (75 cases), and a “low-risk dataset” (328 cases). Deep learning was compared to the use of features from RTA, as well as to a combination of both in the task of distinguishing between high- and low-risk subjects. Similar classification performances were obtained using CNN [area under the curve (AUC)=0.83; standard error (SE)=0.03] and RTA (AUC=0.82; SE=0.03) in distinguishing BRCA1/2 carriers and low-risk women. However, in distinguishing unilateral cancer patients and low-risk women, performance was significantly greater with CNN (AUC=0.82; SE=0.03) compared to RTA (AUC=0.73; SE=0.03). Fusion classifiers performed significantly better than the RTA-alone classifiers with AUC values of 0.86 and 0.84 in differentiating BRCA1/2 carriers from low-risk women and unilateral cancer patients from low-risk women, respectively. In conclusion, deep learning extracted parenchymal characteristics from FFDMs performed as well as, or better than, conventional texture analysis in the task of distinguishing between cancer risk populations."
2016,MO-DE-207B-06: Computer-Aided Diagnosis of Breast Ultrasound Images Using Transfer Learning From Deep Convolutional Neural Networks.,"PURPOSE To assess the performance of using transferred features from pre-trained deep convolutional networks (CNNs) in the task of classifying cancer in breast ultrasound images, and to compare this method of transfer learning with previous methods involving human-designed features. METHODS A breast ultrasound dataset consisting of 1125 cases and 2393 regions of interest (ROIs) was used. Each ROI was labeled as cystic, benign, or malignant. Features were extracted from each ROI using pre-trained CNNs and used to train support vector machine (SVM) classifiers in the tasks of distinguishing non-malignant (benign+cystic) vs malignant lesions and benign vs malignant lesions. For a baseline comparison, classifiers were also trained on prior analytically-extracted tumor features. Five-fold cross-validation (by case) was conducted with the area under the receiver operating characteristic curve (AUC) as the performance metric. RESULTS Classifiers trained on CNN-extracted features were comparable to classifiers trained on human-designed features. In the non-malignant vs malignant task, both the SVM trained on CNN-extracted features and the SVM trained on human-designed features obtained an AUC of 0.90. In the task of determining benign vs malignant, the SVM trained on CNN-extracted features obtained an AUC of 0.88, compared to the AUC of 0.85 obtained by the SVM trained on human-designed features. CONCLUSION We obtained strong results using transfer learning to characterize ultrasound breast cancer images. This method allows us to directly classify a small dataset of lesions in a computationally inexpensive fashion without any manual input. Modern deep learning methods in computer vision are contingent on large datasets and vast computational resources, which are often inaccessible for clinical applications. Consequently, we believe transfer learning methods will be important for computer-aided diagnosis schemes in order to utilize advancements in deep learning and computer vision without the associated costs. This work was partially funded by NIH grant U01 CA195564 and the University of Chicago Metcalf program. M.L.G. is a stockholder in R2/Hologic, co-founder and equity holder in Quantitative Insights, and receives royalties from Hologic, GE Medical Systems, MEDIAN Technologies, Riverain Medical, Mitsubishi, and Toshiba. K.D. received royalties from Hologic."
2019,Breast Cancer Classification in Ultrasound Images using Transfer Learning,"Computer-aided detection of malignant breast tumors in ultrasound images has been receiving growing attention. In this paper, we propose a deep learning methodology to tackle this problem. The training data, which contains several hundred images of benign and malignant cases, was used to train a deep convolutional neural network (CNN). Three training approaches are proposed: a baseline approach where the CNN architecture is trained from scratch, a transfer-learning approach where the pre-trained VGG16 CNN architecture is further trained with the ultrasound images, and a fine-tuned learning approach where the deep learning parameters are fine-tuned to overcome overfitting. The experimental results demonstrate that the fine-tuned model had the best performance (0.97 accuracy, 0.98 AUC), with pre-training on US images. Creating pre-trained models using medical imaging data would certainly improve deep learning outcomes in biomedical applications."
2021,Multi- class classification of breast cancer abnormalities using Deep Convolutional Neural Network (CNN),"The real cause of breast cancer is very challenging to determine and therefore early detection of the disease is necessary for reducing the death rate due to risks of breast cancer. Early detection of cancer boosts increasing the survival chance up to 8%. Primarily, breast images emanating from mammograms, X-Rays or MRI are analyzed by radiologists to detect abnormalities. However, even experienced radiologists face problems in identifying features like micro-calcifications, lumps and masses, leading to high false positive and high false negative. Recent advancement in image processing and deep learning create some hopes in devising more enhanced applications that can be used for the early detection of breast cancer. In this work, we have developed a Deep Convolutional Neural Network (CNN) to segment and classify the various types of breast abnormalities, such as calcifications, masses, asymmetry and carcinomas, unlike existing research work, which mainly classified the cancer into benign and malignant, leading to improved disease management. Firstly, a transfer learning was carried out on our dataset using the pre-trained model ResNet50. Along similar lines, we have developed an enhanced deep learning model, in which learning rate is considered as one of the most important attributes while training the neural network. The learning rate is set adaptively in our proposed model based on changes in error curves during the learning process involved. The proposed deep learning model has achieved a performance of 88% in the classification of these four types of breast cancer abnormalities such as, masses, calcifications, carcinomas and asymmetry mammograms."
2022,Histopathologic Oral Cancer Prediction Using Oral Squamous Cell Carcinoma Biopsy Empowered with Transfer Learning,"Oral cancer is a dangerous and extensive cancer with a high death ratio. Oral cancer is the most usual cancer in the world, with more than 300,335 deaths every year. The cancerous tumor appears in the neck, oral glands, face, and mouth. To overcome this dangerous cancer, there are many ways to detect like a biopsy, in which small chunks of tissues are taken from the mouth and tested under a secure and hygienic microscope. However, microscope results of tissues to detect oral cancer are not up to the mark, a microscope cannot easily identify the cancerous cells and normal cells. Detection of cancerous cells using microscopic biopsy images helps in allaying and predicting the issues and gives better results if biologically approaches apply accurately for the prediction of cancerous cells, but during the physical examinations microscopic biopsy images for cancer detection there are major chances for human error and mistake. So, with the development of technology deep learning algorithms plays a major role in medical image diagnosing. Deep learning algorithms are efficiently developed to predict breast cancer, oral cancer, lung cancer, or any other type of medical image. In this study, the proposed model of transfer learning model using AlexNet in the convolutional neural network to extract rank features from oral squamous cell carcinoma (OSCC) biopsy images to train the model. Simulation results have shown that the proposed model achieved higher classification accuracy 97.66% and 90.06% of training and testing, respectively."
2021,Conventional Machine Learning versus Deep Learning for Magnification Dependent Histopathological Breast Cancer Image Classification: A Comparative Study with Visual Explanation,"Breast cancer is a serious threat to women. Many machine learning-based computer-aided diagnosis (CAD) methods have been proposed for the early diagnosis of breast cancer based on histopathological images. Even though many such classification methods achieved high accuracy, many of them lack the explanation of the classification process. In this paper, we compare the performance of conventional machine learning (CML) against deep learning (DL)-based methods. We also provide a visual interpretation for the task of classifying breast cancer in histopathological images. For CML-based methods, we extract a set of handcrafted features using three feature extractors and fuse them to get image representation that would act as an input to train five classical classifiers. For DL-based methods, we adopt the transfer learning approach to the well-known VGG-19 deep learning architecture, where its pre-trained version on the large scale ImageNet, is block-wise fine-tuned on histopathological images. The evaluation of the proposed methods is carried out on the publicly available BreaKHis dataset for the magnification dependent classification of benign and malignant breast cancer and their eight sub-classes, and a further validation on KIMIA Path960, a magnification-free histopathological dataset with 20 image classes, is also performed. After providing the classification results of CML and DL methods, and to better explain the difference in the classification performance, we visualize the learned features. For the DL-based method, we intuitively visualize the areas of interest of the best fine-tuned deep neural networks using attention maps to explain the decision-making process and improve the clinical interpretability of the proposed models. The visual explanation can inherently improve the pathologist’s trust in automated DL methods as a credible and trustworthy support tool for breast cancer diagnosis. The achieved results show that DL methods outperform CML approaches where we reached an accuracy between 94.05% and 98.13% for the binary classification and between 76.77% and 88.95% for the eight-class classification, while for DL approaches, the accuracies range from 85.65% to 89.32% for the binary classification and from 63.55% to 69.69% for the eight-class classification."
2016,High-Content Analysis of Breast Cancer Using Single-Cell Deep Transfer Learning,"High-content analysis has revolutionized cancer drug discovery by identifying substances that alter the phenotype of a cell, which prevents tumor growth and metastasis. The high-resolution biofluorescence images from assays allow precise quantitative measures enabling the distinction of small molecules of a host cell from a tumor. In this work, we are particularly interested in the application of deep neural networks (DNNs), a cutting-edge machine learning method, to the classification of compounds in chemical mechanisms of action (MOAs). Compound classification has been performed using image-based profiling methods sometimes combined with feature reduction methods such as principal component analysis or factor analysis. In this article, we map the input features of each cell to a particular MOA class without using any treatment-level profiles or feature reduction methods. To the best of our knowledge, this is the first application of DNN in this domain, leveraging single-cell information. Furthermore, we use deep transfer learning (DTL) to alleviate the intensive and computational demanding effort of searching the huge parameter’s space of a DNN. Results show that using this approach, we obtain a 30% speedup and a 2% accuracy improvement."
2021,Review of Breast Cancer Pathologigcal Image Processing,"Breast cancer is one of the most common malignancies. Pathological image processing of breast has become an important means for early diagnosis of breast cancer. Using medical image processing to assist doctors to detect potential breast cancer as early as possible has always been a hot topic in the field of medical image diagnosis. In this paper, a breast cancer recognition method based on image processing is systematically expounded from four aspects: breast cancer detection, image segmentation, image registration, and image fusion. The achievements and application scope of supervised learning, unsupervised learning, deep learning, CNN, and so on in breast cancer examination are expounded. The prospect of unsupervised learning and transfer learning for breast cancer diagnosis is prospected. Finally, the privacy protection of breast cancer patients is put forward."
2019,Transfer Learning in Breast Mammogram Abnormalities Classification With Mobilenet and Nasnet,"Breast cancer has an important incidence in women mortality worldwide. Currently, mammography is considered the gold standard for breast abnormalities screening examinations since it aids in the early detection and diagnosis of the illness. However, both identification of mass lesions and its malignancy classification is a challenging problem for artificial intelligence. Research has turned to the use of deep learning models in mammography which can enhance the performance of Computer Aided Diagnosis Systems (CADx). In this paper, we present our preliminary results on the use of transfer learning for malignancy classification of breast abnormality. We experiment with models that, according to our literature review, have not yet been explored thoroughly such as NasNet and MobileNet. Their performance is compared with InceptionV3 and Resnet50. The best results were obtained with Resnet50 and MobileNet with 78.4% and 74.3%, respectively. Also, some image pre-processing steps are studied in order to increase classification accuracy."
2020,Breast Cancer Classification Using Deep Learning Approaches and Histopathology Image: A Comparison Study,"Convolutional Neural Network (CNN) models are a type of deep learning architecture introduced to achieve the correct classification of breast cancer. This paper has a two-fold purpose. The first aim is to investigate the various deep learning models in classifying breast cancer histopathology images. This study identified the most accurate models in terms of the binary, four, and eight classifications of breast cancer histopathology image databases. The different accuracy scores obtained for the deep learning models on the same database showed that other factors such as pre-processing, data augmentation, and transfer learning methods can impact the ability of the models to achieve higher accuracy. The second purpose of our manuscript is to investigate the latest models that have no or limited examination done in previous studies. The models like ResNeXt, Dual Path Net, SENet, and NASNet had been identified with the most cutting-edge results for the ImageNet database. These models were examined for the binary, and eight classifications on BreakHis, a breast cancer histopathology image database. Furthermore, the BACH database was used to investigate these models for four classifications. Then, these models were compared with the previous studies to find and propose the most state-of-the-art models for each classification. Since the Inception-ResNet-V2 architecture achieved the best results for binary and eight classifications, we have examined this model in our study as well to provide a better comparison result. In short, this paper provides an extensive evaluation and discussion about the experimental settings for each study that had been conducted on the breast cancer histopathology images."
2020,Deep Learning Applied for Histological Diagnosis of Breast Cancer,"Deep learning, as one of the currently most popular computer science research trends, improves neural networks, which has more and deeper layers allowing higher abstraction levels and more accurate data analysis. Although deep convolutional neural networks, as a deep learning algorithm, has recently achieved promising results in data analysis, the requirement for a large amount of data prevents its use in medical data analysis since it is challenging to obtain data from the medical field. Breast cancer is a common cancer in women. To diagnose this kind of cancer, breast cell shapes in histopathology images should be examined by senior pathologists. The number of pathologists per population in the world is not enough, especially in Africa, and human mistake may occur in diagnosis procedure. After the evaluation of deep learning methods and algorithms in breast histological data processing, we tried to improve the current systems’ accuracy. As a result, this study proposes two effective deep transfer learning-based models, which rely on pre-trained DCNN using a large collection of ImageNet dataset images that improve current state-of-the-art systems in both binary and multiclass classification. We transfer pre-trained weights of the ResNet50 and DesneNet121 on the Imagenet as initial weights and fine-tune these models with a deep classifier with data augmentation to detect various malignant and benign samples tissues in the two categories of binary classification and multiclass classification. The proposed models have been examined with optimized hyperparameters in magnification-dependent and magnification-independent classification modes. In the multiclass classification, the proposed system achieved up to 98% accuracy. As for binary classification, the proposed system provides up to 100% accuracy. The results outperform previous studies accuracies in all defined performance metrics in breast cancer CAD systems from histological images."
