2022,Automated Breast Cancer Detection Models Based on Transfer Learning,"Breast cancer is among the leading causes of mortality for females across the planet. It is essential for the well-being of women to develop early detection and diagnosis techniques. In mammography, focus has contributed to the use of deep learning (DL) models, which have been utilized by radiologists to enhance the needed processes to overcome the shortcomings of human observers. The transfer learning method is being used to distinguish malignant and benign breast cancer by fine-tuning multiple pre-trained models. In this study, we introduce a framework focused on the principle of transfer learning. In addition, a mixture of augmentation strategies were used to prevent overfitting and produce stable outcomes by increasing the number of mammographic images; including several rotation combinations, scaling, and shifting. On the Mammographic Image Analysis Society (MIAS) dataset, the proposed system was evaluated and achieved an accuracy of 89.5% using (residual network-50) ResNet50, and achieved an accuracy of 70% using the Nasnet-Mobile network. The proposed system demonstrated that pre-trained classification networks are significantly more effective and efficient, making them more acceptable for medical imaging, particularly for small training datasets."
2019,Photoacoustic Image Classification and Segmentation of Breast Cancer: A Feasibility Study,"Nowadays, breast cancer has increasingly threatened the health of human, especially females. However, breast cancer is still hard to detect in the early stage, and the diagnostic procedure can be time-consuming with abundant expertise needed. In this paper, we explored the deep learning algorithms in emerging photoacoustic tomography for breast cancer diagnostics. Specifically, we used a pre-processing algorithm to enhance the quality and uniformity of input breast cancer images and a transfer learning method to achieve better classification performance. Besides, by comparing the area under the curve, sensitivity, and specificity of support vector machine with AlexNet and GoogLeNet, it can be concluded that the combination of deep learning and photoacoustic imaging has the potential to achieve important impact on clinical diagnostics. Finally, according to the breast imaging reporting and data-system levels, we divided breast cancer images into six grades and designed a segmentation software for identifying the six grades of breast cancer. Then, we tested based on MAMMOGRAPHYC IMAGES DATABASE FROM LAPIMO EESC/USP (Laboratory of Analysis and Processing of Medical and Dental Images) to verify the accuracy of our segmentation method, which showed a satisfactory result."
2023,Vision-Transformer-Based Transfer Learning for Mammogram Classification,"Breast mass identification is a crucial procedure during mammogram-based early breast cancer diagnosis. However, it is difficult to determine whether a breast lump is benign or cancerous at early stages. Convolutional neural networks (CNNs) have been used to solve this problem and have provided useful advancements. However, CNNs focus only on a certain portion of the mammogram while ignoring the remaining and present computational complexity because of multiple convolutions. Recently, vision transformers have been developed as a technique to overcome such limitations of CNNs, ensuring better or comparable performance in natural image classification. However, the utility of this technique has not been thoroughly investigated in the medical image domain. In this study, we developed a transfer learning technique based on vision transformers to classify breast mass mammograms. The area under the receiver operating curve of the new model was estimated as 1 ± 0, thus outperforming the CNN-based transfer-learning models and vision transformer models trained from scratch. The technique can, hence, be applied in a clinical setting, to improve the early diagnosis of breast cancer."
2023,BC2NetRF: Breast Cancer Classification from Mammogram Images Using Enhanced Deep Learning Features and Equilibrium-Jaya Controlled Regula Falsi-Based Features Selection,"One of the most frequent cancers in women is breast cancer, and in the year 2022, approximately 287,850 new cases have been diagnosed. From them, 43,250 women died from this cancer. An early diagnosis of this cancer can help to overcome the mortality rate. However, the manual diagnosis of this cancer using mammogram images is not an easy process and always requires an expert person. Several AI-based techniques have been suggested in the literature. However, still, they are facing several challenges, such as similarities between cancer and non-cancer regions, irrelevant feature extraction, and weak training models. In this work, we proposed a new automated computerized framework for breast cancer classification. The proposed framework improves the contrast using a novel enhancement technique called haze-reduced local-global. The enhanced images are later employed for the dataset augmentation. This step aimed at increasing the diversity of the dataset and improving the training capability of the selected deep learning model. After that, a pre-trained model named EfficientNet-b0 was employed and fine-tuned to add a few new layers. The fine-tuned model was trained separately on original and enhanced images using deep transfer learning concepts with static hyperparameters’ initialization. Deep features were extracted from the average pooling layer in the next step and fused using a new serial-based approach. The fused features were later optimized using a feature selection algorithm known as Equilibrium-Jaya controlled Regula Falsi. The Regula Falsi was employed as a termination function in this algorithm. The selected features were finally classified using several machine learning classifiers. The experimental process was conducted on two publicly available datasets—CBIS-DDSM and INbreast. For these datasets, the achieved average accuracy is 95.4% and 99.7%. A comparison with state-of-the-art (SOTA) technology shows that the obtained proposed framework improved the accuracy. Moreover, the confidence interval-based analysis shows consistent results of the proposed framework."
2022,Breast lesions classifications of mammographic images using a deep convolutional neural network-based approach,"Breast cancer is one of the worst illnesses, with a higher fatality rate among women globally. Breast cancer detection needs accurate mammography interpretation and analysis, which is challenging for radiologists owing to the intricate anatomy of the breast and low image quality. Advances in deep learning-based models have significantly improved breast lesions’ detection, localization, risk assessment, and categorization. This study proposes a novel deep learning-based convolutional neural network (ConvNet) that significantly reduces human error in diagnosing breast malignancy tissues. Our methodology is most effective in eliciting task-specific features, as feature learning is coupled with classification tasks to achieve higher performance in automatically classifying the suspicious regions in mammograms as benign and malignant. To evaluate the model’s validity, 322 raw mammogram images from Mammographic Image Analysis Society (MIAS) and 580 from Private datasets were obtained to extract in-depth features, the intensity of information, and the high likelihood of malignancy. Both datasets are magnificently improved through preprocessing, synthetic data augmentation, and transfer learning techniques to attain the distinctive combination of breast tumors. The experimental findings indicate that the proposed approach achieved remarkable training accuracy of 0.98, test accuracy of 0.97, high sensitivity of 0.99, and an AUC of 0.99 in classifying breast masses on mammograms. The developed model achieved promising performance that helps the clinician in the speedy computation of mammography, breast masses diagnosis, treatment planning, and follow-up of disease progression. Moreover, it has the immense potential over retrospective approaches in consistency feature extraction and precise lesions classification."
2022,Application of Transfer Learning and Ensemble Learning in Image-level Classification for Breast Histopathology,"Background: Breast cancer has the highest prevalence in women globally. The classification and diagnosis of breast cancer and its histopathological images have always been a hot spot of clinical concern. In Computer-Aided Diagnosis (CAD), traditional classification models mostly use a single network to extract features, which has significant limitations. On the other hand, many networks are trained and optimized on patient-level datasets, ignoring the application of lower-level data labels. Method: This paper proposes a deep ensemble model based on image-level labels for the binary classification of benign and malignant lesions of breast histopathological images. First, the BreaKHis dataset is randomly divided into a training, validation and test set. Then, data augmentation techniques are used to balance the number of benign and malignant samples. Thirdly, considering the performance of transfer learning and the complementarity between each network, VGG16, Xception, ResNet50, DenseNet201 are selected as the base classifiers. Result: In the ensemble network model with accuracy as the weight, the image-level binary classification achieves an accuracy of $98.90\%$. In order to verify the capabilities of our method, the latest Transformer and Multilayer Perception (MLP) models have been experimentally compared on the same dataset. Our model wins with a $5\%-20\%$ advantage, emphasizing the ensemble model's far-reaching significance in classification tasks. Conclusion: This research focuses on improving the model's classification performance with an ensemble algorithm. Transfer learning plays an essential role in small datasets, improving training speed and accuracy. Our model has outperformed many existing approaches in accuracy, providing a method for the field of auxiliary medical diagnosis."
2020,Deep Learning in Selected Cancers’ Image Analysis—A Survey,"Deep learning algorithms have become the first choice as an approach to medical image analysis, face recognition, and emotion recognition. In this survey, several deep-learning-based approaches applied to breast cancer, cervical cancer, brain tumor, colon and lung cancers are studied and reviewed. Deep learning has been applied in almost all of the imaging modalities used for cervical and breast cancers and MRIs for the brain tumor. The result of the review process indicated that deep learning methods have achieved state-of-the-art in tumor detection, segmentation, feature extraction and classification. As presented in this paper, the deep learning approaches were used in three different modes that include training from scratch, transfer learning through freezing some layers of the deep learning network and modifying the architecture to reduce the number of parameters existing in the network. Moreover, the application of deep learning to imaging devices for the detection of various cancer cases has been studied by researchers affiliated to academic and medical institutes in economically developed countries; while, the study has not had much attention in Africa despite the dramatic soar of cancer risks in the continent."
2022,Breast Cancer Detection and Classification Empowered With Transfer Learning,"Cancer is a major public health issue in the modern world. Breast cancer is a type of cancer that starts in the breast and spreads to other parts of the body. One of the most common types of cancer that kill women is breast cancer. When cells become uncontrollably large, cancer develops. There are various types of breast cancer. The proposed model discussed benign and malignant breast cancer. In computer-aided diagnosis systems, the identification and classification of breast cancer using histopathology and ultrasound images are critical steps. Investigators have demonstrated the ability to automate the initial level identification and classification of the tumor throughout the last few decades. Breast cancer can be detected early, allowing patients to obtain proper therapy and thereby increase their chances of survival. Deep learning (DL), machine learning (ML), and transfer learning (TL) techniques are used to solve many medical issues. There are several scientific studies in the previous literature on the categorization and identification of cancer tumors using various types of models but with some limitations. However, research is hampered by the lack of a dataset. The proposed methodology is created to help with the automatic identification and diagnosis of breast cancer. Our main contribution is that the proposed model used the transfer learning technique on three datasets, A, B, C, and A2, A2 is the dataset A with two classes. In this study, ultrasound images and histopathology images are used. The model used in this work is a customized CNN-AlexNet, which was trained according to the requirements of the datasets. This is also one of the contributions of this work. The results have shown that the proposed system empowered with transfer learning achieved the highest accuracy than the existing models on datasets A, B, C, and A2."
2022,Breast Cancer Detection in Mammography Images Using Deep Convolutional Neural Networks and Fuzzy Ensemble Modeling Techniques,"Breast cancer has evolved as the most lethal illness impacting women all over the globe. Breast cancer may be detected early, which reduces mortality and increases the chances of a full recovery. Researchers all around the world are working on breast cancer screening tools based on medical imaging. Deep learning approaches have piqued the attention of many in the medical imaging field due to their rapid growth. In this research, mammography pictures were utilized to detect breast cancer. We have used four mammography imaging datasets with a similar number of 1145 normal, benign, and malignant pictures using various deep CNN (Inception V4, ResNet-164, VGG-11, and DenseNet121) models as base classifiers. The proposed technique employs an ensemble approach in which the Gompertz function is used to build fuzzy rankings of the base classification techniques, and the decision scores of the base models are adaptively combined to construct final predictions. The proposed fuzzy ensemble techniques outperform each individual transfer learning methodology as well as multiple advanced ensemble strategies (Weighted Average, Sugeno Integral) with reference to prediction and accuracy. The suggested Inception V4 ensemble model with fuzzy rank based Gompertz function has a 99.32% accuracy rate. We believe that the suggested approach will be of tremendous value to healthcare practitioners in identifying breast cancer patients early on, perhaps leading to an immediate diagnosis."
2023,A Transfer Learning-Based Deep Learning Model for Automated Breast Cancer Identification in Mammograms,"Abstract: Breast cancer is a severe health issue that affects women all over the world, underscoring the need for reliable and effective screening techniques. The early detection, diagnosis, and treatment of breast cancer are made possible by computer-aided diagnostic (CAD) systems that rely on mammograms. This study introduces a unique deep-learning model that uses transfer learning to identify and categorize breast cancer automatically. Deep convolutional neural networks have been shown in several recent studies to diagnose breast cancer in mammograms with performance comparable to or even outperforming that of human experts. In order to extract features from the dataset from the Mammographic Image Analysis Society (MIAS), the proposed model uses pre-trained convolutional neural network (CNN) architectures like ResNet50 and Visual Geometry Group networks (VGG)-16. This novel deep-learning model holds significant potential for enhancing the efficiency and accuracy of breast cancer detection and classification."
2023,Automatic BI-RADS Classification of Breast Magnetic Resonance Medical Records Using Transformer-Based Models for Brazilian Portuguese,"This chapter aims to present a classification model for categorizing textual clinical records of breast magnetic resonance imaging, based on lexical, syntactic and semantic analysis of clinical reports according to the Breast Imaging-Reporting and Data System (BI-RADS) classification, using Deep Learning and Natural Language Processing (NLP). The model was developed from transfer learning based on the pre-trained BERTimbau model, BERT model (Bidirectional Encoder Representations from Transformers) trained in Brazilian Portuguese. The dataset is composed of medical reports in Brazilian Portuguese classified into six categories: Inconclusive; Normal or Negative; Certainly Benign Findings; Probably Benign Findings; Suspicious Findings; High Risk of Cancer; Previously Known Malignant Injury. The following models were implemented and compared: Random Forest, SVM, Naïve Bayes, BERTimbau with and without finetuning. The BERTimbau model presented better results, with better performance after finetuning."
2023,"Classification of Breast Masses Using Ultrasound Images by Approaching GAN, Transfer Learning and Deep Learning Techniques","Breast cancer is a common cause of death among women worldwide. Ultrasonic imaging is a valuable diagnostic tool in breast cancer detection. However, the accuracy of computer-aided diagnosis systems for breast cancer classification is limited due to the lack of well-annotated datasets. This study proposes a deep learning-based framework for breast mass classification using ultrasound images, which incorporates a novel data augmentation technique, Generative Adversarial Network (GAN), and Transfer Learning (TL). Automating early tumor identification and classification in breast cancer diagnosis can save lives by improving the accuracy of diagnoses and reducing the need for invasive procedures. However, the limited availability of well-annotated datasets for ultrasound images of breast cancer has hampered the development of accurate computer-aided diagnosis systems. The accuracy of breast mass classification using ultrasound images is limited due to the lack of well-annotated datasets. Conventional data augmentation techniques have limitations in applications with strict guidelines, such as medical datasets. Therefore, there is a need to develop a novel data augmentation technique to improve the accuracy of breast mass classification using ultrasound images. The proposed framework can be extended to other medical imaging applications, where the availability of well-annotated datasets is limited. The GAN-based data augmentation technique and TL-based feature extraction can be used to improve the accuracy of classification models in other medical imaging applications. Additionally, the proposed framework can be used to develop accurate computer-aided diagnosis systems for breast cancer detection in clinical settings. The proposed framework incorporates a deep learning-based approach for breast mass classification using ultrasound images. The framework includes a GAN-based data augmentation technique and TL for feature extraction. The dataset used for training and testing the model is the Breast Ultrasound Images (BUSI) dataset, which includes 1311 images with normal and abnormal breast masses. The proposed framework achieved an accuracy of 99.6% for breast mass classification using ultrasound images, which outperformed existing methods. The GAN-based data augmentation technique and TL-based feature extraction improved the accuracy of the classification model. The results suggest that deep learning algorithms can be effectively applied for breast ultrasound categorization. The proposed framework presents a novel approach for breast mass classification using ultrasound images, which incorporates a GAN-based data augmentation technique and TL-based feature extraction. The results demonstrate that the proposed framework outperforms existing methods and achieves high accuracy in breast mass classification using ultrasound images. This framework can be useful for developing accurate computer-aided diagnosis systems for breast cancer detection."
2020,Multi-View Attention-based Late Fusion (MVALF) CADx system for breast cancer using deep learning,"Breast cancer is a leading cause of death among women. Early detection can significantly reduce the mortality rate among women and improve their prognosis. Mammography is the first line procedure for early diagnosis. In the early era, conventional Computer-Aided Diagnosis (CADx) systems for breast lesion diagnosis were based on just single view information. The last decade evidence the use of two views mammogram: Medio-Lateral Oblique (MLO) and Cranio-Caudal (CC) view for the CADx systems. Most recent studies show the effectiveness of four views of mammogram to train CADx system with feature fusion strategy for classification task. In this paper, we proposed an end-to-end Multi-View Attention-based Late Fusion (MVALF) CADx system that fused the obtained predictions of four view models, which is trained for each view separately. These separate models have different predictive ability for each class. The appropriate fusion of multi-view models can achieve better diagnosis performance. So, it is necessary to assign the proper weights to the multi-view classification models. To resolve this issue, attention-based weighting mechanism is adopted to assign the proper weights to trained models for fusion strategy. The proposed methodology is used for the classification of mammogram into normal, mass, calcification, malignant masses and benign masses. The publicly available datasets CBIS-DDSM and mini-MIAS are used for the experimentation. The results show that our proposed system achieved 0.996 AUC for normal vs. abnormal, 0.922 for mass vs. calcification and 0.896 for malignant vs. benign masses. Superior results are seen for the classification of malignant vs benign masses with our proposed approach, which is higher than the results using single view, two views and four views early fusion-based systems. The overall results of each level show the potential of multi-view late fusion with transfer learning in the diagnosis of breast cancer."
2022,Breast Tumor Classification in Digital Tomosynthesis Based on Deep Learning Radiomics,"Breast cancer is the most frequently diagnosed cancer in women globally. Early and accurate detection and classification of breast tumors are critical in improving treatment strategies and increasing the patient survival rate. Digital breast tomosynthesis (DBT) is an advanced form of mammography that aids better in the early detection and diagnosis of breast disease. This paper proposes a breast tumor classification method based on analyzing and evaluating the performance of various of the most innovative deep learning classification models in cooperation with a support vector machine (SVM) classifier for a DBT dataset. Specifically, we study the ability to use transfer learning from non-medical images to classify tumors in unseen DBT medical images. In addition, we utilize the fine-tuning technique to improve classification accuracy."
2023,Breast cancer diagnosis through knowledge distillation of Swin transformer-based teacher–student models,"Abstract: Breast cancer is a significant global health concern, emphasizing the crucial need for a timely and accurate diagnosis to enhance survival rates. Traditional diagnostic methods rely on pathologists analyzing whole-slide images (WSIs) to identify and diagnose malignancies. However, this task is complex, demanding specialized expertise and imposing a substantial workload on pathologists. Additionally, existing deep learning models, commonly employed for classifying histopathology images, often need enhancements to ensure their suitability for real-time deployment on WSI, especially when trained for small regions of interest (ROIs). This article introduces two Swin transformer-based architectures: the teacher model, characterized by its moderate size, and the lightweight student model. Both models are trained using a publicly available dataset of breast cancer histopathology images, focusing on ROIs with varying magnification factors. Transfer learning is applied to train the teacher model, and knowledge distillation (KD) transfers its capabilities to the student model. To enhance validation accuracy and minimize the total loss in KD, we employ the state–action–reward–state–action (SARSA) reinforcement learning algorithm. The algorithm dynamically computes temperature and a weighting factor throughout the KD process to achieve high accuracy within a considerably shorter training timeframe. Additionally, the student model is deployed to analyze malignancies in WSI. Despite the student model being only one-third the size and flops of the teacher model, it achieves an impressive accuracy of 98.71%, slightly below the teacher’s accuracy of 98.91%. Experimental results demonstrate that the student model can process WSIs at a throughput of 1.67 samples s"
