2023,Breast Cancer Using Deep Learning and Histopathology Images,"Abstract: Breast cancer is among one of the most common cancers in the world. Early detection in this area can be crucial and help the patients to start the medication. One way to detect the breast cancer is using histopathology images. In recent years deep learning methods are among the methods that have shown high accuracy in detection cancerous tumors in images. In this work different deep learning methods such as Xception, MobileVNet, VGG16 and VGG19 have been used and the results are compared. Two popular datasets in breast cancer have been used. Transfer learning is used for pre-training the structures. In addition, different preprocessing methods is introduced and used to increase the number of images in the dataset."
2023,Breast Cancer Detection Using Image Processing and Machine Learning,"Different breast cancer detection systems have been developed to help clinicians analyze screening mammograms. Breast cancer has been increasing gradually so scientists work to develop new methods to reduce the risks of this life-threatening disease. Convolutional Neural Networks (CNNs) have shown much promise In the field of medical imaging because of recent developments in deep learning. However, CNN’s based methods have been restricted due to the small size of the few public breast cancer datasets. This research has developed a new framework and introduced it to detect breast cancer. This framework utilizes Convolutional Neural Networks (CNNs) and image processing to achieve its goal because CNNs have been an important success in image recognition, reaching human performance. An efficient and fast CNN pre-trained object detector called RetinaNet has been used in this research. RetinaNet is an uncomplicated one-stage object detector. A two-stage transfer learning has been used with the selected detector to improve the performance. RetinaNet model is initially trained with a general-purpose dataset called COCO dataset. The transfer learning is then used to apply the RetinaNet model to another dataset of mammograms called the CBIS-DDSM dataset. Finally, the second transfer learning is used to test the RetinaNet model onto a small dataset of mammograms called the INbreast dataset. The results of the proposed two-stage transfer learning (RetinaNet → CBIS-DDSM → INbreast) are better than the other state-of-the-art methods on the public INbreast dataset. Furthermore, the True Positive Rate (TPR) is 0.99 ± 0.02 at 1.67 False Positives per Image (FPPI), which is better than the one-stage transfer learning with a TPR of 0.94 ± 0.02 at 1.67 FPPI."
2023,"Breast Cancer Mass Classification Using Machine Learning, Binary-Coded Genetic Algorithms and an Ensemble of Deep Transfer Learning","Abstract: The diagnosis of breast cancer (BC) as early as possible is crucial for increasing the survival rate. Mammography enables finding the breast tissue changes years before they could develop into cancer symptoms. In this study, machine learning methods for BC mass pathology classification have been investigated using the radiologists’ mass annotations on the screen-film mammograms of the Breast Cancer Digital Repository (BCDR). The performances of precomputed features in the BCDR and discrete wavelet transform followed by Radon transform have been investigated by using four sequential feature selections and three genetic algorithms. Feature fusion from craniocaudal and mediolateral oblique views was shown to increase the performance of the classifier. Mass classification has been implemented by deep transfer learning (DTL) using the weights of ResNet50, NASNetLarge and Xception networks. An ensemble of DTL (EDTL) was shown to have higher classification performance than the DTL models. The proposed EDTL has area under the receiver operating curve (AUC) scores of 0.8843 and 0.9089 for mass classification on the region of interest (ROI) and ROI union datasets, respectively. The proposed EDTL has the highest BC mass classification AUC score on the BCDR to date and may be useful for other datasets."
2020,Classification of Breast Cancer from Digital Mammography Using Deep Learning,"Breast cancer is the most frequent in females. Mammography has proven to be the most effective method for the early detection of this type of cancer. Mammographic images are sometimes difficult to understand, due to the nature of the anomalies, the low contrast image and the composition of the mammary tissues, as well as various technological factors such as spatial resolution of the image or noise. Computer-aided diagnostic systems have been developed to increase the accuracy of mammographic examinations and be used by physicians as a second opinion in obtaining the final diagnosis, and thus reduce human errors. Convolutional neural networks are a current trend in computer vision tasks, due to the great performance they have achieved. The present investigation was based on this type of networks to classify into three classes, normal, benign and malignant tumour. Due to the fact that the miniMIAS database used has a low number of images, the transfer learning technique was applied to the Inception v3 pre-trained network. Two convolutional neural network architectures were implemented, obtaining in the architecture with three classes, 86.05% accuracy. On the other hand, in the architecture with two neural networks in series, an accuracy of 88.2% was reached."
2023,Deep Learning in Automating Breast Cancer Diagnosis from Microscopy Images,"Context: Breast cancer is one of the most common cancers in women. With early diagnosis, some breast cancers are highly curable. However, the concordance rate of breast cancer diagnosis from histology slides by pathologists is unacceptably low. Classifying normal versus tumor breast tissues from microscopy images of breast histology is an ideal case to use for deep learning and could help to more reproducibly diagnose breast cancer. Since data preprocessing and hyperparameter configurations have impacts on breast cancer classification accuracies of deep learning models, training a deep learning classifier with appropriate data preprocessing approaches and optimized hyperparameter configurations could improve breast cancer classification accuracy. Methods and Material: Using 12 combinations of deep learning model architectures (i.e., including 5 non-specialized and 7 digital pathology-specialized model architectures), image data preprocessing, and hyperparameter configurations, the validation accuracy of tumor versus normal classification were calculated using the Results: The DenseNet201, a non-specialized model architecture, with transfer learning approach achieved 98.61% validation accuracy compared to only 64.00% for the digital pathology-specialized model architecture. Conclusions: The combination of image data preprocessing approaches and hyperparameter configurations have a profound impact on the performance of deep neural networks for image classification. To identify a well-performing deep neural network to classify tumor versus normal breast histology, researchers should not only focus on developing new models specifically for digital pathology, since hyperparameter tuning for existing deep neural networks in the computer vision field could also achieve a high (often better) prediction accuracy."
2022,Skin Cancer Detection Using Deep Learning and Artificial Intelligence: Incorporated model of deep features fusion,"Among the most frequent forms of cancer, skin cancer accounts for hundreds of thousands of fatalities annually throughout the globe. It shows up as excessive cell proliferation on the skin. The likelihood of a successful recovery is greatly enhanced by an early diagnosis. More than that, it might reduce the need for or the frequency of chemical, radiological, or surgical treatments. As a result, savings on healthcare expenses will be possible. Dermoscopy, which examines the size, form, and color features of skin lesions, is the first step in the process of detecting skin cancer and is followed by sample and lab testing to confirm any suspicious lesions. Deep learning AI has allowed for significant progress in image-based diagnostics in recent years. Deep neural networks known as convolutional neural networks (CNNs or ConvNets) are essentially an extended form of multi-layer perceptrons. In visual imaging challenges, CNNs have shown the best accuracy. The purpose of this research is to create a CNN model for the early identification of skin cancer. The backend of the CNN classification model will be built using Keras and Tensorflow in Python. Different network topologies, such as Convolutional layers, Dropout layers, Pooling layers, and Dense layers, are explored and tried out throughout the model's development and validation phases. Transfer Learning methods will also be included in the model to facilitate early convergence. The dataset gathered from the ISIC challenge archives will be used to both tests and train the model."
2020,A New Deep Learning Model Selection Method for Colorectal Cancer Classification,"<p>Deep learning is one of the most commonly used techniques in computer-aided diagnosis systems. Their exploitation for histopathological image analysis is important because of the complex morphology of whole slide images. However, the main limitation of these methods is the restricted number of available medical images, which can lead to an overfitting problem. Many studies have suggested the use of static ensemble learning methods to address this issue. This article aims to propose a new dynamic ensemble deep learning method. First, it generates a set of models based on the transfer learning strategy from deep neural networks. Then, the relevant subset of models is selected by the particle swarm optimization algorithm and combined by voting or averaging methods. The proposed approach was tested on a histopathological dataset for colorectal cancer classification, based on seven types of CNNs. The method has achieved accurate results (94.52%) by the Resnet121 model and the voting strategy, which provides important insights into the efficiency of dynamic ensembling in deep learning.</p>"
2022,Deep-learning and transfer learning identify new breast cancer survival subtypes from single-cell imaging data,"STATEMENT OF TRANSLATIONAL RELEVANCE: Our findings from a breast cancer population cohort demonstrate the clinical utility of using the single-cell level imaging mass cytometry (IMC) data as a new type of patient prognosis prediction marker. Not only did the prognosis prediction achieve high accuracy with a Concordance index score greater than 0.8, it also enabled the discovery of seven survival subtypes that are more distinguishable than the molecular subtypes. These new subtypes present distinct profiles of epithelial, immune, fibroblast cells, and their interactions. Most importantly, this study identified and validated atypical subpopulations of TNBC patients with moderate prognosis (GATA3 over-expression) and Luminal A patients with poor prognosis (KRT6 and ACTA2 over-expression and CDH1 under-expression), using multiple large breast cancer cohorts."
2022,Machine Learning and Deep Learning Algorithms for Skin Cancer Classification from Dermoscopic Images,"We carry out a critical assessment of machine learning and deep learning models for the classification of skin tumors. Machine learning (ML) algorithms tested in this work include logistic regression, linear discriminant analysis, k-nearest neighbors classifier, decision tree classifier and Gaussian naive Bayes, while deep learning (DL) models employed are either based on a custom Convolutional Neural Network model, or leverage transfer learning via the use of pre-trained models (VGG16, Xception and ResNet50). We find that DL models, with accuracies up to 0.88, all outperform ML models. ML models exhibit accuracies below 0.72, which can be increased to up to 0.75 with ensemble learning. To further assess the performance of DL models, we test them on a larger and more imbalanced dataset. Metrics, such as the F-score and accuracy, indicate that, after fine-tuning, pre-trained models perform extremely well for skin tumor classification. This is most notably the case for VGG16, which exhibits an F-score of 0.88 and an accuracy of 0.88 on the smaller database, and metrics of 0.70 and 0.88, respectively, on the larger database."
2022,Hybrid Model for Breast Cancer Diagnosis on Mammograms Using Transfer Learning,"Abstract: Breast cancer is one of the most common types of cancer among women all over the world, which leads to the death of many women every year due to misdiagnosis and late treatment. Therefore, in this research, a new deep learning model was developed based on Python and using the mini-MIAS dataset. Initially image contrast optimization operations and segmentation were performed to enhance image and extract the region of interest (breast region) in order to improve the performance of the model and increase the accuracy of diagnosis and then extract the features using the transfer learning technique and based on a set of pre-trained networks. A comparison was made between a set of pre-trained convolutional network architectures (VGG16, ResNet50, MobileNetV2, InceptionV3) where the VGG16 network gave the best performance in the phase of extracting features and then building the final hybrid model by merging the VGG16 network with the random forest classifier. Our model achieved 94.25% average accuracy and the Area under curve (AUC) is 98% for all three classes, in addition to reducing the time required to build the system."
2022,Detection of Breast Cancer Images Based on Transfer and Deep Learning Models,"Abstract: Using a technology known as deep learning, which involves classifying photos based on the data they contain, it is possible to detect images, such as tumors and other signs. Because of the scarcity of pathologists and the growing number of patients with breast cancer, the manual numeration of biopsy echantillons must be mechanized (CS). To rectify the histopathological images of malignant tissue, preliminary study is required, which can be done utilizing BreaKHis' free database of data. An approach based on isolated image fragments is proposed, with the final categorization determined by an interconnected network of neurons (CNN) and a final combination of these pieces. Because of its unique architecture, capacity to recognize speech, identify objects, and analyze signals, as well as the popularity of neural language processing, the CNN is attracting increasing interest from industry and researchers. The employment of transfer learning methods is a problem with tiny collections of medical data. To improve the classification of defamatory and obscene photos, this article recommends integrating the impacts of many resolutions. In order to better depict the entering image's texture, many essential phases in CNN development are also used. Maintain a safe distance from the model's customization. Traditional CNN development may become more complex and expensive as a result. The simulation results achieved by running CNN in MATLAB outperform other artificial intelligence (AI) models recently published that used hand-crafted texture descriptors. With this in mind, we looked at all of CNN's possible combinations and discovered a technique to boost the execution rate by a little amount."
2021,Deep Multi-View Breast Cancer Detection: A Multi-View Concatenated Infrared Thermal Images Based Breast Cancer Detection System Using Deep Transfer Learning,"This paper simply presents a fully automated breast cancer detection system as “Deep Multi-view Breast cancer Detection” based on deep transfer learning. The deep transfer learning model i.e., Visual Geometry Group 16 (VGG 16) is used in this approach for the correct classification of Breast thermal images into either normal or abnormal. This VGG 16 model is trained with the help of Static as well as Dynamic breast thermal images dataset consisting of multi-view, single view breast thermal images. These Multi-view breast thermal images are generated in this approach by concatenating the conventional left, frontal and right view breast thermal images taken from the Database for Mastology Research with Infrared image for the first time in order to generate a more informative and complete thermal temperature map of breast for enhancing the accuracy of the overall system. For the sake of genuine comparison, three other popular deep transfer learning models like Residual Network 50 (ResNet50V2), InceptionV3 network and Visual Geometry Group 19 (VGG 19) are also trained with the same augmented dataset consisting of multi-view as well as single view breast thermal images. The VGG 16 based Deep Multi-view Breast cancer Detect system delivers the best training, validation as well as testing accuracies as compared to their other deep transfer learning models. The VGG 16 achieves an encouraging testing accuracy of 99% on the Dynamic breast thermal images testing dataset utilizing the multi-view breast thermal images as input. Whereas the testing accuracies of 95%, 94% and 89% are achieved by the VGG 19, ResNet50V2, InceptionV3 models respectively over the Dynamic breast thermal images testing dataset utilizing the same multi-view breast thermal images as input."
2023,Assessing VTE Risk in Cancer Patients Using Deep Learning Synthetic Data Generation and Domain Adaptation Techniques,"This article focuses on the use of deep learning synthetic data generation methods to assess the risk of future treatments and medication for preventing venous thromboembolism (VTE) in cancer patients, based on a small dataset of genetic and clinical variables. The study employs CopulaGANs to generate synthetic tabular data, which is then used to train a Deep Learning-based classifier using domain adaptation techniques. The trained model is fine-tuned using real data and performs better than current state-of-the-art medical scores in assessing VTE risk. Additionally, the resulting Precision-Recall curve offers flexibility in selecting different and better operational points for VTE risk assessment."
2018,A deep learning method for classifying mammographic breast density categories,"PURPOSE Mammographic breast density is an established risk marker for breast cancer and is visually assessed by radiologists in routine mammogram image reading, using four qualitative Breast Imaging and Reporting Data System (BI-RADS) breast density categories. It is particularly difficult for radiologists to consistently distinguish the two most common and most variably assigned BI-RADS categories, i.e., ""scattered density"" and ""heterogeneously dense"". The aim of this work was to investigate a deep learning-based breast density classifier to consistently distinguish these two categories, aiming at providing a potential computerized tool to assist radiologists in assigning a BI-RADS category in current clinical workflow. METHODS In this study, we constructed a convolutional neural network (CNN)-based model coupled with a large (i.e., 22,000 images) digital mammogram imaging dataset to evaluate the classification performance between the two aforementioned breast density categories. All images were collected from a cohort of 1,427 women who underwent standard digital mammography screening from 2005 to 2016 at our institution. The truths of the density categories were based on standard clinical assessment made by board-certified breast imaging radiologists. Effects of direct training from scratch solely using digital mammogram images and transfer learning of a pretrained model on a large nonmedical imaging dataset were evaluated for the specific task of breast density classification. In order to measure the classification performance, the CNN classifier was also tested on a refined version of the mammogram image dataset by removing some potentially inaccurately labeled images. Receiver operating characteristic (ROC) curves and the area under the curve (AUC) were used to measure the accuracy of the classifier. RESULTS The AUC was 0.9421 when the CNN-model was trained from scratch on our own mammogram images, and the accuracy increased gradually along with an increased size of training samples. Using the pretrained model followed by a fine-tuning process with as few as 500 mammogram images led to an AUC of 0.9265. After removing the potentially inaccurately labeled images, AUC was increased to 0.9882 and 0.9857 for without and with the pretrained model, respectively, both significantly higher (P < 0.001) than when using the full imaging dataset. CONCLUSIONS Our study demonstrated high classification accuracies between two difficult to distinguish breast density categories that are routinely assessed by radiologists. We anticipate that our approach will help enhance current clinical assessment of breast density and better support consistent density notification to patients in breast cancer screening."
2021,Novel Transfer Learning Approach for Medical Imaging with Limited Labeled Data,"Deep learning requires a large amount of data to perform well. However, the field of medical image analysis suffers from a lack of sufficient data for training deep learning models. Moreover, medical images require manual labeling, usually provided by human annotators coming from various backgrounds. More importantly, the annotation process is time-consuming, expensive, and prone to errors. Transfer learning was introduced to reduce the need for the annotation process by transferring the deep learning models with knowledge from a previous task and then by fine-tuning them on a relatively small dataset of the current task. Most of the methods of medical image classification employ transfer learning from pretrained models, e.g., ImageNet, which has been proven to be ineffective. This is due to the mismatch in learned features between the natural image, e.g., ImageNet, and medical images. Additionally, it results in the utilization of deeply elaborated models. In this paper, we propose a novel transfer learning approach to overcome the previous drawbacks by means of training the deep learning model on large unlabeled medical image datasets and by next transferring the knowledge to train the deep learning model on the small amount of labeled medical images. Additionally, we propose a new deep convolutional neural network (DCNN) model that combines recent advancements in the field. We conducted several experiments on two challenging medical imaging scenarios dealing with skin and breast cancer classification tasks. According to the reported results, it has been empirically proven that the proposed approach can significantly improve the performance of both classification scenarios. In terms of skin cancer, the proposed model achieved an F1-score value of 89.09% when trained from scratch and 98.53% with the proposed approach. Secondly, it achieved an accuracy value of 85.29% and 97.51%, respectively, when trained from scratch and using the proposed approach in the case of the breast cancer scenario. Finally, we concluded that our method can possibly be applied to many medical imaging problems in which a substantial amount of unlabeled image data is available and the labeled image data is limited. Moreover, it can be utilized to improve the performance of medical imaging tasks in the same domain. To do so, we used the pretrained skin cancer model to train on feet skin to classify them into two classes—either normal or abnormal (diabetic foot ulcer (DFU)). It achieved an F1-score value of 86.0% when trained from scratch, 96.25% using transfer learning, and 99.25% using double-transfer learning."
2019,Deep Learning for Breast Cancer Diagnosis from Mammograms—A Comparative Study,"Deep convolutional neural networks (CNNs) are investigated in the context of computer-aided diagnosis (CADx) of breast cancer. State-of-the-art CNNs are trained and evaluated on two mammographic datasets, consisting of ROIs depicting benign or malignant mass lesions. The performance evaluation of each examined network is addressed in two training scenarios: the first involves initializing the network with pre-trained weights, while for the second the networks are initialized in a random fashion. Extensive experimental results show the superior performance achieved in the case of fine-tuning a pretrained network compared to training from scratch."
