2016,Breast cancer histopathological image classification using Convolutional Neural Networks,"The performance of most conventional classification systems relies on appropriate data representation and much of the efforts are dedicated to feature engineering, a difficult and time-consuming process that uses prior expert domain knowledge of the data to create useful features. On the other hand, deep learning can extract and organize the discriminative information from the data, not requiring the design of feature extractors by a domain expert. Convolutional Neural Networks (CNNs) are a particular type of deep, feedforward network that have gained attention from research community and industry, achieving empirical successes in tasks such as speech recognition, signal processing, object recognition, natural language processing and transfer learning. In this paper, we conduct some preliminary experiments using the deep learning approach to classify breast cancer histopathological images from BreaKHis, a publicly dataset available at http://web.inf.ufpr.br/vri/breast-cancer-database. We propose a method based on the extraction of image patches for training the CNN and the combination of these patches for final classification. This method aims to allow using the high-resolution histopathological images from BreaKHis as input to existing CNN, avoiding adaptations of the model that can lead to a more complex and computationally costly architecture. The CNN performance is better when compared to previously reported results obtained by other machine learning models trained with hand-crafted textural descriptors. Finally, we also investigate the combination of different CNNs using simple fusion rules, achieving some improvement in recognition rates."
2018,A deep learning method for classifying mammographic breast density categories,"PURPOSE Mammographic breast density is an established risk marker for breast cancer and is visually assessed by radiologists in routine mammogram image reading, using four qualitative Breast Imaging and Reporting Data System (BI-RADS) breast density categories. It is particularly difficult for radiologists to consistently distinguish the two most common and most variably assigned BI-RADS categories, i.e., ""scattered density"" and ""heterogeneously dense"". The aim of this work was to investigate a deep learning-based breast density classifier to consistently distinguish these two categories, aiming at providing a potential computerized tool to assist radiologists in assigning a BI-RADS category in current clinical workflow. METHODS In this study, we constructed a convolutional neural network (CNN)-based model coupled with a large (i.e., 22,000 images) digital mammogram imaging dataset to evaluate the classification performance between the two aforementioned breast density categories. All images were collected from a cohort of 1,427 women who underwent standard digital mammography screening from 2005 to 2016 at our institution. The truths of the density categories were based on standard clinical assessment made by board-certified breast imaging radiologists. Effects of direct training from scratch solely using digital mammogram images and transfer learning of a pretrained model on a large nonmedical imaging dataset were evaluated for the specific task of breast density classification. In order to measure the classification performance, the CNN classifier was also tested on a refined version of the mammogram image dataset by removing some potentially inaccurately labeled images. Receiver operating characteristic (ROC) curves and the area under the curve (AUC) were used to measure the accuracy of the classifier. RESULTS The AUC was 0.9421 when the CNN-model was trained from scratch on our own mammogram images, and the accuracy increased gradually along with an increased size of training samples. Using the pretrained model followed by a fine-tuning process with as few as 500 mammogram images led to an AUC of 0.9265. After removing the potentially inaccurately labeled images, AUC was increased to 0.9882 and 0.9857 for without and with the pretrained model, respectively, both significantly higher (P < 0.001) than when using the full imaging dataset. CONCLUSIONS Our study demonstrated high classification accuracies between two difficult to distinguish breast density categories that are routinely assessed by radiologists. We anticipate that our approach will help enhance current clinical assessment of breast density and better support consistent density notification to patients in breast cancer screening."
2021,Novel Transfer Learning Approach for Medical Imaging with Limited Labeled Data,"Deep learning requires a large amount of data to perform well. However, the field of medical image analysis suffers from a lack of sufficient data for training deep learning models. Moreover, medical images require manual labeling, usually provided by human annotators coming from various backgrounds. More importantly, the annotation process is time-consuming, expensive, and prone to errors. Transfer learning was introduced to reduce the need for the annotation process by transferring the deep learning models with knowledge from a previous task and then by fine-tuning them on a relatively small dataset of the current task. Most of the methods of medical image classification employ transfer learning from pretrained models, e.g., ImageNet, which has been proven to be ineffective. This is due to the mismatch in learned features between the natural image, e.g., ImageNet, and medical images. Additionally, it results in the utilization of deeply elaborated models. In this paper, we propose a novel transfer learning approach to overcome the previous drawbacks by means of training the deep learning model on large unlabeled medical image datasets and by next transferring the knowledge to train the deep learning model on the small amount of labeled medical images. Additionally, we propose a new deep convolutional neural network (DCNN) model that combines recent advancements in the field. We conducted several experiments on two challenging medical imaging scenarios dealing with skin and breast cancer classification tasks. According to the reported results, it has been empirically proven that the proposed approach can significantly improve the performance of both classification scenarios. In terms of skin cancer, the proposed model achieved an F1-score value of 89.09% when trained from scratch and 98.53% with the proposed approach. Secondly, it achieved an accuracy value of 85.29% and 97.51%, respectively, when trained from scratch and using the proposed approach in the case of the breast cancer scenario. Finally, we concluded that our method can possibly be applied to many medical imaging problems in which a substantial amount of unlabeled image data is available and the labeled image data is limited. Moreover, it can be utilized to improve the performance of medical imaging tasks in the same domain. To do so, we used the pretrained skin cancer model to train on feet skin to classify them into two classes—either normal or abnormal (diabetic foot ulcer (DFU)). It achieved an F1-score value of 86.0% when trained from scratch, 96.25% using transfer learning, and 99.25% using double-transfer learning."
2022,Breast Cancer Classification from Ultrasound Images Using Probability-Based Optimal Deep Learning Feature Fusion,"After lung cancer, breast cancer is the second leading cause of death in women. If breast cancer is detected early, mortality rates in women can be reduced. Because manual breast cancer diagnosis takes a long time, an automated system is required for early cancer detection. This paper proposes a new framework for breast cancer classification from ultrasound images that employs deep learning and the fusion of the best selected features. The proposed framework is divided into five major steps: (i) data augmentation is performed to increase the size of the original dataset for better learning of Convolutional Neural Network (CNN) models; (ii) a pre-trained DarkNet-53 model is considered and the output layer is modified based on the augmented dataset classes; (iii) the modified model is trained using transfer learning and features are extracted from the global average pooling layer; (iv) the best features are selected using two improved optimization algorithms known as reformed differential evaluation (RDE) and reformed gray wolf (RGW); and (v) the best selected features are fused using a new probability-based serial approach and classified using machine learning algorithms. The experiment was conducted on an augmented Breast Ultrasound Images (BUSI) dataset, and the best accuracy was 99.1%. When compared with recent techniques, the proposed framework outperforms them."
2021,Deep-Learning-Empowered Breast Cancer Auxiliary Diagnosis for 5GB Remote E-Health,"Breast cancer, the most common cancer in women, is receiving increasing attention. The lack of high-quality medical resources, especially highly skilled doctors, in remote areas makes the diagnosis of breast cancer inefficient and causes great harm to women. The emergence of remote e-health has improved the situation to a certain extent, but its capabilities are still hampered by technical limitations, which manifest in two main aspects. First, due to network bandwidth limitations, it is difficult to guarantee the real-time transmission of breast cancer pathology images between remote areas and cities. Second, the highly skilled breast cancer doctors at large city hospitals are not guaranteed to be available for online diagnosis at all times. To overcome these limitations, this article proposes a deep-learning-empowered breast cancer auxiliary diagnosis scheme for remote e-health supported by 5G technology and beyond (5GB remote e-health). In this scheme, breast pathology images are first received from major hospitals via 5G, and a deep learning model based on the Inception-v3 network is subjected to transfer learning to obtain a diagnostic model. This diagnostic model is then employed on edge servers for auxiliary diagnosis at remote area hospitals. A theoretical analysis and experimental results show that this solution not only overcomes the two problems mentioned above but also improves the diagnostic accuracy for breast cancer in remote areas to 98.19 percent."
2020,Deep Learning Assisted Efficient AdaBoost Algorithm for Breast Cancer Detection and Early Diagnosis,"Breast cancer is one of the most dangerous diseases and the second largest cause of female cancer death. Breast cancer starts when malignant, cancerous lumps start to grow from the breast cells. Self-tests and Periodic clinical checks help to early diagnosis and thereby improve the survival chances significantly. The breast cancer classification is a medical method that provides researchers and scientists with a great challenge. Neural networks have recently become a popular tool in cancer data classification. In this paper, Deep Learning assisted Efficient Adaboost Algorithm (DLA-EABA) for breast cancer detection has been mathematically proposed with advanced computational techniques. In addition to traditional computer vision approaches, tumor classification methods using transfers are being actively developed through the use of deep convolutional neural networks (CNNs). This study starts with examining the CNN-based transfer learning to characterize breast masses for different diagnostic, predictive tasks or prognostic or in several imaging modalities, such as Magnetic Resonance Imaging (MRI), Ultrasound (US), digital breast tomosynthesis and mammography. The deep learning framework contains several convolutional layers, LSTM, Max-pooling layers. The classification and error estimation that has been included in a fully connected layer and a softmax layer. This paper focuses on combining these machine learning approaches with the methods of selecting features and extracting them through evaluating their output using classification and segmentation techniques to find the most appropriate approach. The experimental results show that the high accuracy level of 97.2%, Sensitivity 98.3%, and Specificity 96.5% has been compared to other existing systems."
2020,Optimizing the Performance of Breast Cancer Classification by Employing the Same Domain Transfer Learning from Hybrid Deep Convolutional Neural Network Model,"Breast cancer is a significant factor in female mortality. An early cancer diagnosis leads to a reduction in the breast cancer death rate. With the help of a computer-aided diagnosis system, the efficiency increased, and the cost was reduced for the cancer diagnosis. Traditional breast cancer classification techniques are based on handcrafted features techniques, and their performance relies upon the chosen features. They also are very sensitive to different sizes and complex shapes. However, histopathological breast cancer images are very complex in shape. Currently, deep learning models have become an alternative solution for diagnosis, and have overcome the drawbacks of classical classification techniques. Although deep learning has performed well in various tasks of computer vision and pattern recognition, it still has some challenges. One of the main challenges is the lack of training data. To address this challenge and optimize the performance, we have utilized a transfer learning technique which is where the deep learning models train on a task, and then fine-tune the models for another task. We have employed transfer learning in two ways: Training our proposed model first on the same domain dataset, then on the target dataset, and training our model on a different domain dataset, then on the target dataset. We have empirically proven that the same domain transfer learning optimized the performance. Our hybrid model of parallel convolutional layers and residual links is utilized to classify hematoxylin–eosin-stained breast biopsy images into four classes: invasive carcinoma, in-situ carcinoma, benign tumor and normal tissue. To reduce the effect of overfitting, we have augmented the images with different image processing techniques. The proposed model achieved state-of-the-art performance, and it outperformed the latest methods by achieving a patch-wise classification accuracy of 90.5%, and an image-wise classification accuracy of 97.4% on the validation set. Moreover, we have achieved an image-wise classification accuracy of 96.1% on the test set of the microscopy ICIAR-2018 dataset."
2021,Transfer Learning in Breast Cancer Diagnoses via Ultrasound Imaging,"Simple Summary Transfer learning plays a major role in medical image analyses; however, obtaining adequate training image datasets for machine learning algorithms can be challenging. Although many studies have attempted to employ transfer learning in medical image analyses, thus far, only a few review articles regarding the application of transfer learning to medical image analyses have been published. Moreover, reviews on the application of transfer learning in ultrasound breast imaging are rare. This work reviews previous studies that focused on detecting breast cancer from ultrasound images by using transfer learning, in order to summarize existing methods and identify their advantages and shortcomings. Additionally, this review presents potential future research directions for applying transfer learning in ultrasound imaging for the purposes of breast cancer detection and diagnoses. This review is expected to be significantly helpful in guiding researchers to identify potential improved methods and areas that can be improved through further research on transfer learning-based ultrasound breast imaging. Abstract Transfer learning is a machine learning approach that reuses a learning method developed for a task as the starting point for a model on a target task. The goal of transfer learning is to improve performance of target learners by transferring the knowledge contained in other (but related) source domains. As a result, the need for large numbers of target-domain data is lowered for constructing target learners. Due to this immense property, transfer learning techniques are frequently used in ultrasound breast cancer image analyses. In this review, we focus on transfer learning methods applied on ultrasound breast image classification and detection from the perspective of transfer learning approaches, pre-processing, pre-training models, and convolutional neural network (CNN) models. Finally, comparison of different works is carried out, and challenges—as well as outlooks—are discussed."
2017,Deep learning model based breast cancer histopathological image classification,"The automatic and precision classification for breast cancer histopathological image has a great significance in clinical application. However, the existing analysis approaches are difficult to addressing the breast cancer classification problem because the feature subtle differences of inter-class histopathological image and the classification accuracy still hard to meet the clinical application. Recent advancements in data-driven sharing processing and multi-level hierarchical feature learning have made available considerable chance to dope out a solution to this problem. To address the challenging problem, we propose a novel breast cancer histopathological image classification method based on deep convolutional neural networks, named as BiCNN model, to address the two-class breast cancer classification on the pathological image. This deep learning model considers class and sub-class labels of breast cancer as prior knowledge, which can restrain the distance of features of different breast cancer pathological images. In addition, an advanced data augmented method is proposed to fit tolerance whole slide image recognition, which can full reserve image edge feature of cancerization region. The transfer learning and fine-tuning method are adopted as an optimal training strategy to improve breast cancer histopathological image classification accuracy. The experiment results show that the proposed method leads to a higher classification accuracy (up to 97%) and displays good robustness and generalization, which provides efficient tools for breast cancer clinical diagnosis."
2019,A Technical Review of Convolutional Neural Network-Based Mammographic Breast Cancer Diagnosis,"This study reviews the technique of convolutional neural network (CNN) applied in a specific field of mammographic breast cancer diagnosis (MBCD). It aims to provide several clues on how to use CNN for related tasks. MBCD is a long-standing problem, and massive computer-aided diagnosis models have been proposed. The models of CNN-based MBCD can be broadly categorized into three groups. One is to design shallow or to modify existing models to decrease the time cost as well as the number of instances for training; another is to make the best use of a pretrained CNN by transfer learning and fine-tuning; the third is to take advantage of CNN models for feature extraction, and the differentiation of malignant lesions from benign ones is fulfilled by using machine learning classifiers. This study enrolls peer-reviewed journal publications and presents technical details and pros and cons of each model. Furthermore, the findings, challenges and limitations are summarized and some clues on the future work are also given. Conclusively, CNN-based MBCD is at its early stage, and there is still a long way ahead in achieving the ultimate goal of using deep learning tools to facilitate clinical practice. This review benefits scientific researchers, industrial engineers, and those who are devoted to intelligent cancer diagnosis."
2022,Ensemble Deep-Learning-Enabled Clinical Decision Support System for Breast Cancer Diagnosis and Classification on Ultrasound Images,"Simple Summary In the literature, there exist plenty of research works focused on the detection and classification of breast cancer. However, only a few works have focused on the classification of breast cancer using ultrasound scan images. Although deep transfer learning models are useful in breast cancer classification, owing to their outstanding performance in a number of applications, image pre-processing and segmentation techniques are essential. In this context, the current study developed a new Ensemble Deep-Learning-Enabled Clinical Decision Support System for the diagnosis and classification of breast cancer using ultrasound images. In the study, an optimal multi-level thresholding-based image segmentation technique was designed to identify the tumor-affected regions. The study also developed an ensemble of three deep learning models for feature extraction and an optimal machine learning classifier for breast cancer detection. The study offers a means of assisting radiologists and healthcare professionals in the breast cancer classification process. Abstract Clinical Decision Support Systems (CDSS) provide an efficient way to diagnose the presence of diseases such as breast cancer using ultrasound images (USIs). Globally, breast cancer is one of the major causes of increased mortality rates among women. Computer-Aided Diagnosis (CAD) models are widely employed in the detection and classification of tumors in USIs. The CAD systems are designed in such a way that they provide recommendations to help radiologists in diagnosing breast tumors and, furthermore, in disease prognosis. The accuracy of the classification process is decided by the quality of images and the radiologist’s experience. The design of Deep Learning (DL) models is found to be effective in the classification of breast cancer. In the current study, an Ensemble Deep-Learning-Enabled Clinical Decision Support System for Breast Cancer Diagnosis and Classification (EDLCDS-BCDC) technique was developed using USIs. The proposed EDLCDS-BCDC technique was intended to identify the existence of breast cancer using USIs. In this technique, USIs initially undergo pre-processing through two stages, namely wiener filtering and contrast enhancement. Furthermore, Chaotic Krill Herd Algorithm (CKHA) is applied with Kapur’s entropy (KE) for the image segmentation process. In addition, an ensemble of three deep learning models, VGG-16, VGG-19, and SqueezeNet, is used for feature extraction. Finally, Cat Swarm Optimization (CSO) with the Multilayer Perceptron (MLP) model is utilized to classify the images based on whether breast cancer exists or not. A wide range of simulations were carried out on benchmark databases and the extensive results highlight the better outcomes of the proposed EDLCDS-BCDC technique over recent methods."
2019,Deep Learning Approaches for Data Augmentation and Classification of Breast Masses using Ultrasound Images,"Breast classification and detection using ultrasound imaging is considered a significant step in computer-aided diagno-sis systems. Over the previous decades, researchers have proved the opportunities to automate the initial tumor classification and detection. The shortage of popular datasets of ultrasound images of breast cancer prevents researchers from obtaining a good performance of the classification algorithms. Traditional augmentation approaches are firmly limited, especially in tasks where the images follow strict standards, as in the case of medical datasets. Therefore besides the traditional augmentation, we use a new methodology for data augmentation using Generative Adversarial Network (GAN). We achieved higher accuracies by integrating traditional with GAN-based augmentation. This paper uses two breast ultrasound image datasets obtained from two various ultrasound systems. The first dataset is our dataset which was collected from Baheya Hospital for Early Detection and Treatment of Women’s Cancer, Cairo (Egypt), we name it (BUSI) referring to Breast Ultrasound Images (BUSI) dataset. It contains 780 images (133 normal, 437 benign and 210 malignant). While the Dataset (B) is obtained from related work and it has 163 images (110 benign and 53 malignant). To overcome the shortage of public datasets in this field, BUSI dataset will be publicly available for researchers. Moreover, in this paper, deep learning approaches are proposed to be used for breast ultrasound classification. We examine two different methods: a Convolutional Neural Network (CNN) approach and a Transfer Learning (TL) approach and we compare their performance with and without augmentation. The results confirm an overall enhancement using augmentation methods with deep learning classification methods (especially transfer learning) when evaluated on the two datasets."
2017,A method for classifying medical images using transfer learning: A pilot study on histopathology of breast cancer,"The advance of deep learning has made huge changes in computer vision and produced various off-the-shelf trained models. Particularly, Convolutional Neural Network (CNN) has been widely used to build image classification model which allow researchers transfer the pre-trained learning model for other classifications. We propose a transfer learning method to detect breast cancer using histopathology images based on Google's Inception v3 model which were initially trained for the classification of non-medical images. The pilot study shows the feasibility of transfer learning in the detection of breast cancer with AUC of 0.93."
